title,link,contents
" 취업 준비가 너무 힘들 때, 잠깐 쉬어가도 괜찮을까요?",https://kin.naver.com/qna/detail.naver?d1id=4&dirId=40602&docId=491860736&qb=7Leo7JeF&enc=utf8," 반복되는 취업 준비에 지쳐가고 있어요. 자격증, 면접, 자소서까지 챙기려니 정말 멘탈이 붕괴될 것 같아요. 주변 친구들은 하나둘씩 취업하는데 저만 뒤처지는 것 같아서 더 초조해지네요. 혹시 여러분은 취업 준비하면서 지칠 때 어떻게 힐링하셨나요? 잠깐 쉬어가도 괜찮을지, 아니면 끝까지 버텨야 하는지 여러분의 경험이 궁금해요."
 비전공자가 대전VMD학원다니고 취업할 수 있을까요?,https://kin.naver.com/qna/detail.naver?d1id=3&dirId=31301&docId=352317545&qb=7Leo7JeF&enc=utf8,"하세요. 전공은 경영학과지만 최근 매장 VMD에 관심이 생겼습니다. 졸업학년이라 부전공을 하기에는 늦었다고 생각되서 학원을 알아보고 있는게 이게 맞는건지 걱정돼서 질문남겨요. 1. 비전공자도 취업할 수 있을까요? 2. 잡코리아나 사람인에서 검색해보면 포토샵, 일러스트, 2D 캐드, 맥스 등등 있던데 뭘배워야할까요? 부모님은 저 하고싶은거 하라면서 알아보라고하는데 만약 학원을 다닌다면 VMD를 전문적으로 배울 수 있는곳이 있을까요?"
 국비지원 수업시작하고 국민취업지원제도 신청 가능한가요?,https://kin.naver.com/qna/detail.naver?d1id=4&dirId=40612&docId=491622363&qb=7Leo7JeF&enc=utf8,지원으로 수업듣기 시작했는데 수업듣기 시작한 뒤에 국민취업지원제도가 있는걸 알게되었는데 수업듣기 시작한 이후에 국민취업지원제도 신청해도 되나요?
 국민취업제도1유형 & 내일배움카드,https://kin.naver.com/qna/detail.naver?d1id=6&dirId=60804&docId=491648776&qb=7Leo7JeF&enc=utf8,"취업제도 1유형에 선발이 되었어요. 바로 취업준비를 하는게 아니고 내일배움카드로 평소에 하고 싶었던 배움학원을 다니려고 합니다.이럴 경우엔 학원수강 자체가 구직활동으로 해당이 될까요?대부분 이력서 제출이나, 직접 면접도 가면서 구직 활동을 한다고 하더라구요.저 같은 경우는 학원을 다니면서 자격증을 따고 나서 구직활동을 하게 될거라서요이럴경우는 어떻게 하면 될지 답변 부탁드립니다^^"
 취업신고 후 지급금액 언제 되나요?,https://kin.naver.com/qna/detail.naver?d1id=6&dirId=6080402&docId=490267921&qb=7Leo7JeF&enc=utf8, 22일 실업인정일인데 20일에 취업을 해서 신청한지 13일이 다 되어갑니다혹시 지급은 언제되는지 알 수 있을까요?고용24어플에서는 계속 처리중이라고 하는데 조금 더 걸리는걸까요?만약 그게 아니라면 언제 받을 수 있나요?
 출소후에 사람의 취업은 어떻게 하나요?,https://kin.naver.com/qna/detail.naver?d1id=6&dirId=6020601&docId=491037971&qb=7Leo7JeF&enc=utf8, 아는 사람이 징역 2년 7개월정도 친족 성추행 죄로 들어 갔는데요..(참고로 내년에 나옵니다)만약 이렇게 출소한 사람은 혹시 어떤데서 취업이 가능할까요…?그리고 이런말 좀.. 무겁고 하면 안되는거 알지만… 혹시나 이런 출소자가 받을수 있는 지원이나 혜택이 있을까요..?(죄송합니다...)
 실내디자인학원 비전공자도 취업까지 가능할까요?,https://kin.naver.com/qna/detail.naver?d1id=11&dirId=1119&docId=274739167&qb=7Leo7JeF&enc=utf8,디자인학원에 관심이 많은 비전공자예요.(__)고등학교를 졸업하고 계약직으로 근무를 하고 있어요.일을 하면서도 미래가 불확실해서 많이 불안해요.안정적인 직장을 갖고 싶어도 특별한 기술이 없네요.저희 친척 분이 인테리어디자이너인데저보고 실내디자인학원다니고 취업하라고 하는데이게 말은 쉽지 현실적으로 가능한건가요?
 실업급여 구직활동 취업증명서 프린터 해가야하나요?,https://kin.naver.com/qna/detail.naver?d1id=6&dirId=6080402&docId=491743087&qb=7Leo7JeF&enc=utf8,4차인데요 구직활동 잡코리아에서 두번 했습니다취업증명서 이거를 뽑아서가야하나요 아니면인터넷으로 발송후 방문해야하나요
 30대 남자 세무사 사무실 취업 가능합니까?,https://kin.naver.com/qna/detail.naver?d1id=4&dirId=403&docId=491133861&qb=7Leo7JeF&enc=utf8,사 시험을 막 시작한 30초 남자 입니다. 1~2년 준비 후 어느 정도 합격각이 보이면 좀 더 매진 하고 아니면 전산세무 취득 후 세무사 사무실 취업을 해서 사무장이 되는 것을 목표로 해보고자 합니다다만 제가 이 분야 경험이 없고 나이가 있어 가능 할지 궁금합니다..업계 상황을 잘 아시는 분들의 조언 주시면 감사드리겠습니다.
 국가국가장학금 취업연계중점대학유형,https://kin.naver.com/qna/detail.naver?d1id=11&dirId=110503&docId=491476419&qb=7Leo7JeF&enc=utf8," 편입학 합격발표가 이번에 나왔는데요.국가장학금 신청기간도 지났고,국가근로장학금 (1.2차 통합)신청기간은 끝난듯해서 신청표시가 없더라구요.제가 지난 학기 성적이 괜찮아서 국가근로장학금을 꼭 신청하고 싶은데요.취업연계중점대학유형만 신청가능한 표시가 뜹니다. 1.2차 통합유형은 제가 원하는곳을 선택할 수 있었는데취업연계는 학과와 연계된 곳만 제가 갈 수 있는것인지 학과 상관없이 집 근처에 원하는 곳에 선택할 수는 없는것인지 궁금합니다."
